TCIL,,Rafala,Rajkot,India,360003,"In Information Technology TCIL has established its IT Training Centre TCIL- IT which is running various courses duly approved by Department of Electronics, Govt. of India for career advancement. Keeping in view the rising need for quality computer professionals, TCIL has introduced a gamut of comprehensive computer courses in Software, Hardware, Multimedia, Telecom, Interior Designing and Fashion Technology through its countrywide network. Over the years TCIL has built up a solid reputation for offering world class training in software, hardware and multimedia courses. From Indian Army, Banks to Multinational majors?TCIL -IT is being sought after by the biggest and the best for imparting IT Training. The curriculum development team of TCIL is in regular touch with today?s industry and updates the course curriculum regularly to meet its demands. As the course curriculum is designed giving equal importance to theoretical knowledge and practical skills, the students will get ample time to work in computers.",[],"['CAE Analysis Training\n                           \n                               classes', 'Embedded & VLSI\n                           \n                               Classes', 'CAE Computer-Aided Engineering\n                           \n                               Training', 'Cloud Testing\n                           \n                               Training', 'Cloud Computing\n                           \n                               Classes', 'CAD\n                           \n                               Training']",https://s3-ap-southeast-1.amazonaws.com/tv-prod/member/photo/787428-medium190ap.gif,[]
TCIL,,Rajkot Mandvi Chowk,Rajkot,India,360001,"In Information Technology TCIL has established its IT Training Centre TCIL- IT which is running various courses duly approved by Department of Electronics, Govt. of India for career advancement. Keeping in view the rising need for quality computer professionals, TCIL has introduced a gamut of comprehensive computer courses in Software, Hardware, Multimedia, Telecom, Interior Designing and Fashion Technology through its countrywide network. Over the years TCIL has built up a solid reputation for offering world class training in software, hardware and multimedia courses. From Indian Army, Banks to Multinational majors?TCIL -IT is being sought after by the biggest and the best for imparting IT Training. The curriculum development team of TCIL is in regular touch with today?s industry and updates the course curriculum regularly to meet its demands. As the course curriculum is designed giving equal importance to theoretical knowledge and practical skills, the students will get ample time to work in computers.",[],"['CAE Analysis Training\n                           \n                               classes', 'Embedded & VLSI\n                           \n                               Classes', 'CAE Computer-Aided Engineering\n                           \n                               Training', 'Cloud Testing\n                           \n                               Training', 'Cloud Computing\n                           \n                               Classes', 'CAD\n                           \n                               Training']",https://s3-ap-southeast-1.amazonaws.com/tv-prod/member/photo/787341-medium190ap.gif,[]
Planet CAD-CAM-CAE,,Kankot,Rajkot,India,360005,"Planet CAD-CAM-CAE Computer Institute in Ahmedabad is leading center for all the Hardware and Networking Related Courses. We are specialized in Pro/E, CAD/CAM, Autodesk Revit. Your happiness is our satisfaction. We are experienced service providers catering to the requirements of our valuable clients.",[],"['CAE Analysis Training\n                           \n                               classes', 'CAD\n                           \n                               Training']",https://c.urbanpro.com/assets/new-ui/institute-200X200-1cadc0a5074600eb6978b2bd141bd303.png,[]
TCIL,,Jivapar,Rajkot,India,360040,"In Information Technology TCIL has established its IT Training Centre TCIL- IT which is running various courses duly approved by Department of Electronics, Govt. of India for career advancement. Keeping in view the rising need for quality computer professionals, TCIL has introduced a gamut of comprehensive computer courses in Software, Hardware, Multimedia, Telecom, Interior Designing and Fashion Technology through its countrywide network. Over the years TCIL has built up a solid reputation for offering world class training in software, hardware and multimedia courses. From Indian Army, Banks to Multinational majors?TCIL -IT is being sought after by the biggest and the best for imparting IT Training. The curriculum development team of TCIL is in regular touch with today?s industry and updates the course curriculum regularly to meet its demands. As the course curriculum is designed giving equal importance to theoretical knowledge and practical skills, the students will get ample time to work in computers.",[],"['CAE Analysis Training\n                           \n                               classes', 'Embedded & VLSI\n                           \n                               Classes', 'CAE Computer-Aided Engineering\n                           \n                               Training', 'Cloud Testing\n                           \n                               Training', 'Cloud Computing\n                           \n                               Classes', 'CAD\n                           \n                               Training']",https://s3-ap-southeast-1.amazonaws.com/tv-prod/member/photo/787435-medium190ap.gif,[]
TCIL,,Dholara,Rajkot,India,360002,"In Information Technology TCIL has established its IT Training Centre TCIL- IT which is running various courses duly approved by Department of Electronics, Govt. of India for career advancement. Keeping in view the rising need for quality computer professionals, TCIL has introduced a gamut of comprehensive computer courses in Software, Hardware, Multimedia, Telecom, Interior Designing and Fashion Technology through its countrywide network. Over the years TCIL has built up a solid reputation for offering world class training in software, hardware and multimedia courses. From Indian Army, Banks to Multinational majors?TCIL -IT is being sought after by the biggest and the best for imparting IT Training. The curriculum development team of TCIL is in regular touch with today?s industry and updates the course curriculum regularly to meet its demands. As the course curriculum is designed giving equal importance to theoretical knowledge and practical skills, the students will get ample time to work in computers.",[],"['CAE Analysis Training\n                           \n                               classes', 'Embedded & VLSI\n                           \n                               Classes', 'Cloud Testing\n                           \n                               Training', 'Cloud Computing\n                           \n                               Classes', 'CAD\n                           \n                               Training']",https://s3-ap-southeast-1.amazonaws.com/tv-prod/member/photo/787403-medium190ap.gif,[]
cadd centre,,Rajkot City,Rajkot,India,360001,"CADD Centre, Asia's biggest network of franchise-based training centres for Computer Aided Design (CAD), Computer Aided Engineering (CAE), and Computer Aided Manufacturing (CAM), offers over 100 courses for students and working professionals of Mechanical, Civil, Electrical & Electronics engineering, Architecture, and Project Management disciplines.",[],"['CAE Analysis Training\n                           \n                               classes', 'Electrical CAD\n                           \n                               Training', 'Electronic CAD\n                           \n                               Training', 'Mechanical CAD\n                           \n                               Training', 'CAD\n                           \n                               Training']",https://s3-ap-southeast-1.amazonaws.com/tv-prod/member/photo/785135-medium190ap.jpg,[]
